<?xml version="1.0" encoding="UTF-8"?>

<könyvesboltok xmlns:xs="http://www.w3.org/2001/XMLSchema-instance" xs:noNamespaceSchemaLocation="XMLSchemaBQLOTW.xsd">
    <!-- Könyvesbolt adatai -->
    <könyvesbolt üzletID="1">
        <cím>
            <irányítószám>1011</irányítószám>
            <város>Budapest</város>
            <utca>Fő utca</utca>
            <házszám>15</házszám>
        </cím>
        <telefon>06-1-201-3456</telefon>
        <telefon>06-1-201-3457</telefon>
    </könyvesbolt>

    <!-- Leltár -->
    <leltár leltárID="1" üzletID="1">
        <időbélyeg>2025-11-26T10:30:00</időbélyeg>
        <összérték>125000.50</összérték>
    </leltár>

    <!-- KÖNYVEK -->
    <könyv isbn="978-3-16-148410-0" leltárID="1" adószám="12345678">
        <cím>A Gyűrűk Ura</cím>
        <műfaj>Fantasy</műfaj>
        <műfaj>Kaland</műfaj>
        <ár>4999.99</ár>
        <készlet>5</készlet>
    </könyv>

    <könyv isbn="978-0-14-028329-7" leltárID="1" adószám="87654321">
        <cím>1984</cím>
        <műfaj>Sci-Fi</műfaj>
        <műfaj>Disztópia</műfaj>
        <ár>3499.00</ár>
        <készlet>8</készlet>
    </könyv>

    <!-- Szerzője kapcsolatok-->
    <szerzője isbn="978-3-16-148410-0" íróID="1"/>
    <szerzője isbn="978-0-14-028329-7" íróID="2"/>

    <!-- ÍRÓK -->
    <író íróID="1">
        <név>
            <vezetéknév>Tolkien</vezetéknév>
            <keresztnév>John Ronald Reuel</keresztnév>
        </név>
        <születésiDátum>1892-01-03</születésiDátum>
        <nemzetiség>Angol</nemzetiség>
    </író>

    <író íróID="2">
        <név>
            <vezetéknév>Orwell</vezetéknév>
            <keresztnév>George</keresztnév>
        </név>
        <születésiDátum>1903-06-25</születésiDátum>
        <nemzetiség>Angol</nemzetiség>
    </író>

    <!-- Tartalmaz kapcsolatok -->
    <tartalmaz isbn="978-3-16-148410-0" eladásID="1"/>
    <tartalmaz isbn="978-0-14-028329-7" eladásID="1"/>

    <eladás eladásID="1">
        <dátum>2025-11-26T14:15:00</dátum>
        <érték>8498</érték>
        <kedvezmény>0.10</kedvezmény>
    </eladás>

    <!-- KIADÓK -->
    <kiadó adószám="12345678">
        <név>Tolkien Publisher</név>
        <alapítás>1920-01-01</alapítás>
        <székhely>Oxford, UK</székhely>
    </kiadó>

    <kiadó adószám="87654321">
        <név>Penguin Books</név>
        <alapítás>1935-07-30</alapítás>
        <székhely>London, UK</székhely>
    </kiadó>

</könyvesboltok>